{
 "subject_id": "TQAEP-9b665469cd3b9364",
 "version": "1",
 "content_hash": "9b665469cd3b9364b8dad8735d8e2f05d38b2b7e82dedd4d61eb0838e36b990f",
 "schema_version": "TQAEP@1",
 "tests": [
  {
   "test_id": "TEST-REQ-INTENT",
   "requirement": "REQ-INTENT",
   "oracle": "deterministic assertion on the bound artifact",
   "positive_fixture": "fixtures/REQ-INTENT/positive",
   "negative_fixture": "fixtures/REQ-INTENT/negative",
   "evidence_expectation": "EVD-REQ-INTENT"
  },
  {
   "test_id": "TEST-REQ-KNOWLEDGE",
   "requirement": "REQ-KNOWLEDGE",
   "oracle": "deterministic assertion on the bound artifact",
   "positive_fixture": "fixtures/REQ-KNOWLEDGE/positive",
   "negative_fixture": "fixtures/REQ-KNOWLEDGE/negative",
   "evidence_expectation": "EVD-REQ-KNOWLEDGE"
  },
  {
   "test_id": "TEST-REQ-VERIFY",
   "requirement": "REQ-VERIFY",
   "oracle": "deterministic assertion on the bound artifact",
   "positive_fixture": "fixtures/REQ-VERIFY/positive",
   "negative_fixture": "fixtures/REQ-VERIFY/negative",
   "evidence_expectation": "EVD-REQ-VERIFY"
  },
  {
   "test_id": "TEST-REQ-DELIVER",
   "requirement": "REQ-DELIVER",
   "oracle": "deterministic assertion on the bound artifact",
   "positive_fixture": "fixtures/REQ-DELIVER/positive",
   "negative_fixture": "fixtures/REQ-DELIVER/negative",
   "evidence_expectation": "EVD-REQ-DELIVER"
  },
  {
   "test_id": "TEST-REQ-GOVERN",
   "requirement": "REQ-GOVERN",
   "oracle": "deterministic assertion on the bound artifact",
   "positive_fixture": "fixtures/REQ-GOVERN/positive",
   "negative_fixture": "fixtures/REQ-GOVERN/negative",
   "evidence_expectation": "EVD-REQ-GOVERN"
  }
 ],
 "oracles": [
  "TEST-REQ-INTENT: deterministic assertion on the bound artifact",
  "TEST-REQ-KNOWLEDGE: deterministic assertion on the bound artifact",
  "TEST-REQ-VERIFY: deterministic assertion on the bound artifact",
  "TEST-REQ-DELIVER: deterministic assertion on the bound artifact",
  "TEST-REQ-GOVERN: deterministic assertion on the bound artifact"
 ],
 "fixtures": [
  "fixtures/REQ-INTENT/positive",
  "fixtures/REQ-KNOWLEDGE/positive",
  "fixtures/REQ-VERIFY/positive",
  "fixtures/REQ-DELIVER/positive",
  "fixtures/REQ-GOVERN/positive"
 ],
 "acceptance": [
  "INDEPENDENT_CASE_PASS"
 ],
 "requalification": "affected-only"
}